{
  "schema_version": 1,
  "id": "level-19-high-rise",
  "title": "High Rise",
  "order": 19,
  "difficulty": 5,
  "split": "train",
  "tags": [
    "height",
    "jump",
    "elevation"
  ],
  "summary": "Four ascending tiers 35 cm apart with gaps: jump up, land short, repeat.",
  "time_limit_seconds": 42.0,
  "par_time_seconds": 20.0,
  "units": {
    "distance": "m",
    "angle": "degree",
    "up_axis": "+z",
    "forward_axis": "+x"
  },
  "spawn": {
    "position": [
      0.0,
      0.0,
      0.94
    ],
    "yaw_degrees": 0.0
  },
  "finish": {
    "position": [
      8.4,
      0.0,
      2.32
    ],
    "radius": 0.9
  },
  "bounds": {
    "minimum": [
      -3.5,
      -4.0,
      -3.0
    ],
    "maximum": [
      11.5,
      4.0,
      5.0
    ]
  },
  "obstacles": [
    {
      "id": "start",
      "kind": "platform",
      "position": [
        0.7,
        0.0,
        -0.2
      ],
      "size": [
        1.7,
        1.2,
        0.2
      ]
    },
    {
      "id": "gap-1",
      "kind": "gap",
      "position": [
        2.6,
        0.0,
        0.0
      ],
      "size": [
        0.2,
        1.0,
        0.02
      ]
    },
    {
      "id": "tier-1",
      "kind": "platform",
      "position": [
        3.4,
        0.0,
        -0.025
      ],
      "size": [
        0.6,
        0.95,
        0.375
      ]
    },
    {
      "id": "gap-2",
      "kind": "gap",
      "position": [
        4.2,
        0.0,
        0.0
      ],
      "size": [
        0.2,
        0.9,
        0.02
      ]
    },
    {
      "id": "tier-2",
      "kind": "platform",
      "position": [
        5.0,
        0.0,
        0.15
      ],
      "size": [
        0.6,
        0.85,
        0.55
      ]
    },
    {
      "id": "gap-3",
      "kind": "gap",
      "position": [
        5.8,
        0.0,
        0.0
      ],
      "size": [
        0.2,
        0.8,
        0.02
      ]
    },
    {
      "id": "tier-3",
      "kind": "platform",
      "position": [
        6.6,
        0.0,
        0.325
      ],
      "size": [
        0.6,
        0.8,
        0.725
      ]
    },
    {
      "id": "gap-4",
      "kind": "gap",
      "position": [
        7.4,
        0.0,
        0.0
      ],
      "size": [
        0.2,
        0.75,
        0.02
      ]
    },
    {
      "id": "tier-4",
      "kind": "rooftop",
      "position": [
        8.3,
        0.0,
        0.5
      ],
      "size": [
        0.7,
        0.9,
        0.9
      ]
    }
  ]
}
