{
  "schema_version": 1,
  "id": "level-04-balance-beam",
  "title": "Balance Beam",
  "order": 4,
  "difficulty": 2,
  "split": "train",
  "tags": [
    "balance",
    "narrow"
  ],
  "summary": "Cross a 4 m long beam that is only 50 cm wide; lateral foot placement matters.",
  "time_limit_seconds": 26.0,
  "par_time_seconds": 12.0,
  "units": {
    "distance": "m",
    "angle": "degree",
    "up_axis": "+z",
    "forward_axis": "+x"
  },
  "spawn": {
    "position": [
      0.0,
      0.0,
      0.94
    ],
    "yaw_degrees": 0.0
  },
  "finish": {
    "position": [
      7.5,
      0.0,
      0.92
    ],
    "radius": 0.9
  },
  "bounds": {
    "minimum": [
      -3.5,
      -4.0,
      -3.0
    ],
    "maximum": [
      10.7,
      4.0,
      5.0
    ]
  },
  "obstacles": [
    {
      "id": "start",
      "kind": "platform",
      "position": [
        0.6,
        0.0,
        -0.2
      ],
      "size": [
        1.6,
        1.2,
        0.2
      ]
    },
    {
      "id": "beam",
      "kind": "rail",
      "position": [
        4.2,
        0.0,
        -0.2
      ],
      "size": [
        2.0,
        0.25,
        0.2
      ]
    },
    {
      "id": "end",
      "kind": "platform",
      "position": [
        7.2,
        0.0,
        -0.2
      ],
      "size": [
        1.0,
        1.2,
        0.2
      ]
    }
  ]
}
