{
  "schema_version": 1,
  "id": "level-07-spike-lane",
  "title": "Spike Lane",
  "order": 7,
  "difficulty": 2,
  "split": "train",
  "tags": [
    "hazard",
    "weave"
  ],
  "summary": "Two spike strips block one side of the lane: weave through the free side.",
  "time_limit_seconds": 28.0,
  "par_time_seconds": 13.0,
  "units": {
    "distance": "m",
    "angle": "degree",
    "up_axis": "+z",
    "forward_axis": "+x"
  },
  "spawn": {
    "position": [
      0.0,
      0.0,
      0.94
    ],
    "yaw_degrees": 0.0
  },
  "finish": {
    "position": [
      7.4,
      0.0,
      0.92
    ],
    "radius": 0.85
  },
  "bounds": {
    "minimum": [
      -3.5,
      -4.0,
      -3.0
    ],
    "maximum": [
      10.5,
      4.0,
      5.0
    ]
  },
  "obstacles": [
    {
      "id": "runway",
      "kind": "platform",
      "position": [
        3.5,
        0.0,
        -0.2
      ],
      "size": [
        4.5,
        1.4,
        0.2
      ]
    },
    {
      "id": "spikes-a",
      "kind": "spike_strip",
      "position": [
        3.1,
        0.7,
        -0.17
      ],
      "size": [
        0.5,
        0.65,
        0.23
      ],
      "hazard": true
    },
    {
      "id": "spikes-b",
      "kind": "spike_strip",
      "position": [
        5.3,
        -0.7,
        -0.17
      ],
      "size": [
        0.5,
        0.65,
        0.23
      ],
      "hazard": true
    }
  ]
}
