{
  "schema_version": 1,
  "id": "level-09-stepping-stones",
  "title": "Stepping Stones",
  "order": 9,
  "difficulty": 3,
  "split": "train",
  "tags": [
    "precision",
    "gap",
    "lateral"
  ],
  "summary": "Four offset 70 cm stones with 35 cm gaps: precise foot placement plus lateral correction.",
  "time_limit_seconds": 32.0,
  "par_time_seconds": 15.0,
  "units": {
    "distance": "m",
    "angle": "degree",
    "up_axis": "+z",
    "forward_axis": "+x"
  },
  "spawn": {
    "position": [
      0.0,
      0.0,
      0.94
    ],
    "yaw_degrees": 0.0
  },
  "finish": {
    "position": [
      8.0,
      0.0,
      0.92
    ],
    "radius": 0.9
  },
  "bounds": {
    "minimum": [
      -3.5,
      -4.0,
      -3.0
    ],
    "maximum": [
      11.1,
      4.0,
      5.0
    ]
  },
  "obstacles": [
    {
      "id": "start",
      "kind": "platform",
      "position": [
        0.6,
        0.0,
        -0.2
      ],
      "size": [
        1.6,
        1.1,
        0.2
      ]
    },
    {
      "id": "gap-1",
      "kind": "gap",
      "position": [
        2.375,
        0.0,
        0.0
      ],
      "size": [
        0.175,
        0.6,
        0.02
      ]
    },
    {
      "id": "stone-1",
      "kind": "platform",
      "position": [
        2.9,
        0.25,
        -0.2
      ],
      "size": [
        0.35,
        0.35,
        0.2
      ]
    },
    {
      "id": "gap-2",
      "kind": "gap",
      "position": [
        3.425,
        0.0,
        0.0
      ],
      "size": [
        0.175,
        0.35,
        0.02
      ]
    },
    {
      "id": "stone-2",
      "kind": "platform",
      "position": [
        3.95,
        -0.25,
        -0.2
      ],
      "size": [
        0.35,
        0.35,
        0.2
      ]
    },
    {
      "id": "gap-3",
      "kind": "gap",
      "position": [
        4.475,
        0.0,
        0.0
      ],
      "size": [
        0.175,
        0.35,
        0.02
      ]
    },
    {
      "id": "stone-3",
      "kind": "platform",
      "position": [
        4.99,
        0.25,
        -0.2
      ],
      "size": [
        0.35,
        0.35,
        0.2
      ]
    },
    {
      "id": "gap-4",
      "kind": "gap",
      "position": [
        5.525,
        0.0,
        0.0
      ],
      "size": [
        0.175,
        0.35,
        0.02
      ]
    },
    {
      "id": "stone-4",
      "kind": "platform",
      "position": [
        6.05,
        -0.25,
        -0.2
      ],
      "size": [
        0.35,
        0.35,
        0.2
      ]
    },
    {
      "id": "gap-5",
      "kind": "gap",
      "position": [
        6.575,
        0.0,
        0.0
      ],
      "size": [
        0.175,
        0.35,
        0.02
      ]
    },
    {
      "id": "end",
      "kind": "platform",
      "position": [
        7.675,
        0.0,
        -0.2
      ],
      "size": [
        0.925,
        1.1,
        0.2
      ]
    }
  ]
}
