{
  "schema_version": 1,
  "id": "level-06-hurdles",
  "title": "Hurdles",
  "order": 6,
  "difficulty": 2,
  "split": "train",
  "tags": [
    "hurdle",
    "step"
  ],
  "summary": "Step over three thin hurdles of increasing height.",
  "time_limit_seconds": 26.0,
  "par_time_seconds": 12.0,
  "units": {
    "distance": "m",
    "angle": "degree",
    "up_axis": "+z",
    "forward_axis": "+x"
  },
  "spawn": {
    "position": [
      0.0,
      0.0,
      0.94
    ],
    "yaw_degrees": 0.0
  },
  "finish": {
    "position": [
      7.5,
      0.0,
      0.92
    ],
    "radius": 0.85
  },
  "bounds": {
    "minimum": [
      -3.5,
      -4.0,
      -3.0
    ],
    "maximum": [
      10.5,
      4.0,
      5.0
    ]
  },
  "obstacles": [
    {
      "id": "runway",
      "kind": "platform",
      "position": [
        3.5,
        0.0,
        -0.2
      ],
      "size": [
        4.5,
        1.3,
        0.2
      ]
    },
    {
      "id": "hurdle-1",
      "kind": "wall",
      "position": [
        2.56,
        0.0,
        -0.1
      ],
      "size": [
        0.06,
        1.1,
        0.3
      ]
    },
    {
      "id": "hurdle-2",
      "kind": "wall",
      "position": [
        4.56,
        0.0,
        -0.06
      ],
      "size": [
        0.06,
        1.1,
        0.34
      ]
    },
    {
      "id": "hurdle-3",
      "kind": "wall",
      "position": [
        6.56,
        0.0,
        -0.02
      ],
      "size": [
        0.06,
        1.1,
        0.38
      ]
    }
  ]
}
