{
  "schema_version": 1,
  "id": "level-16-rooftops",
  "title": "Rooftops",
  "order": 16,
  "difficulty": 4,
  "split": "train",
  "tags": [
    "height",
    "gap",
    "fall-risk"
  ],
  "summary": "Elevated platforms 80 cm above the void: a missed landing is a real fall.",
  "time_limit_seconds": 36.0,
  "par_time_seconds": 17.0,
  "units": {
    "distance": "m",
    "angle": "degree",
    "up_axis": "+z",
    "forward_axis": "+x"
  },
  "spawn": {
    "position": [
      0.0,
      0.0,
      1.74
    ],
    "yaw_degrees": 0.0
  },
  "finish": {
    "position": [
      8.8,
      0.0,
      1.72
    ],
    "radius": 0.9
  },
  "bounds": {
    "minimum": [
      -3.5,
      -4.0,
      -3.0
    ],
    "maximum": [
      11.9,
      4.0,
      5.0
    ]
  },
  "obstacles": [
    {
      "id": "roof-1",
      "kind": "rooftop",
      "position": [
        0.8,
        0.0,
        0.2
      ],
      "size": [
        1.8,
        1.1,
        0.6
      ]
    },
    {
      "id": "gap-1",
      "kind": "gap",
      "position": [
        2.875,
        0.0,
        0.0
      ],
      "size": [
        0.275,
        1.1,
        0.02
      ]
    },
    {
      "id": "roof-2",
      "kind": "rooftop",
      "position": [
        3.925,
        0.0,
        0.2
      ],
      "size": [
        0.775,
        0.95,
        0.6
      ]
    },
    {
      "id": "gap-2",
      "kind": "gap",
      "position": [
        4.975,
        0.0,
        0.0
      ],
      "size": [
        0.275,
        0.95,
        0.02
      ]
    },
    {
      "id": "roof-3",
      "kind": "rooftop",
      "position": [
        5.925,
        0.0,
        0.2
      ],
      "size": [
        0.675,
        0.85,
        0.6
      ]
    },
    {
      "id": "gap-3",
      "kind": "gap",
      "position": [
        6.875,
        0.0,
        0.0
      ],
      "size": [
        0.275,
        0.85,
        0.02
      ]
    },
    {
      "id": "roof-4",
      "kind": "rooftop",
      "position": [
        8.275,
        0.0,
        0.2
      ],
      "size": [
        1.125,
        1.0,
        0.6
      ]
    }
  ]
}
