{
  "schema_version": 1,
  "id": "level-20-final-gauntlet",
  "title": "Final Gauntlet",
  "order": 20,
  "difficulty": 5,
  "split": "train",
  "tags": [
    "mixed",
    "hazard",
    "moving",
    "narrow"
  ],
  "summary": "Steps, gaps, spikes, a narrow beam and a sliding platform chained into one course.",
  "time_limit_seconds": 50.0,
  "par_time_seconds": 26.0,
  "units": {
    "distance": "m",
    "angle": "degree",
    "up_axis": "+z",
    "forward_axis": "+x"
  },
  "spawn": {
    "position": [
      0.0,
      0.0,
      0.94
    ],
    "yaw_degrees": 0.0
  },
  "finish": {
    "position": [
      14.0,
      0.0,
      0.92
    ],
    "radius": 0.9
  },
  "bounds": {
    "minimum": [
      -3.5,
      -4.0,
      -3.0
    ],
    "maximum": [
      17.1,
      4.0,
      5.0
    ]
  },
  "obstacles": [
    {
      "id": "start",
      "kind": "platform",
      "position": [
        0.6,
        0.0,
        -0.2
      ],
      "size": [
        1.6,
        1.3,
        0.2
      ]
    },
    {
      "id": "step-up",
      "kind": "step",
      "position": [
        2.5,
        0.0,
        -0.125
      ],
      "size": [
        0.3,
        1.2,
        0.275
      ]
    },
    {
      "id": "gap-1",
      "kind": "gap",
      "position": [
        2.975,
        0.0,
        0.0
      ],
      "size": [
        0.175,
        1.2,
        0.02
      ]
    },
    {
      "id": "landing",
      "kind": "platform",
      "position": [
        3.725,
        0.0,
        -0.125
      ],
      "size": [
        0.575,
        1.2,
        0.275
      ]
    },
    {
      "id": "step-down",
      "kind": "platform",
      "position": [
        4.6,
        0.0,
        -0.2
      ],
      "size": [
        0.3,
        1.3,
        0.2
      ]
    },
    {
      "id": "gap-2",
      "kind": "gap",
      "position": [
        5.15,
        0.0,
        0.0
      ],
      "size": [
        0.25,
        1.2,
        0.02
      ]
    },
    {
      "id": "spike-run",
      "kind": "platform",
      "position": [
        6.2,
        0.0,
        -0.2
      ],
      "size": [
        0.8,
        1.3,
        0.2
      ]
    },
    {
      "id": "spikes",
      "kind": "spike_strip",
      "position": [
        6.25,
        0.0,
        -0.165
      ],
      "size": [
        0.25,
        1.2,
        0.235
      ],
      "hazard": true
    },
    {
      "id": "gap-3",
      "kind": "gap",
      "position": [
        7.25,
        0.0,
        0.0
      ],
      "size": [
        0.25,
        1.0,
        0.02
      ]
    },
    {
      "id": "beam",
      "kind": "rail",
      "position": [
        8.5,
        0.0,
        -0.2
      ],
      "size": [
        1.0,
        0.175,
        0.2
      ]
    },
    {
      "id": "gap-4",
      "kind": "gap",
      "position": [
        10.0,
        0.0,
        0.0
      ],
      "size": [
        0.5,
        0.8,
        0.02
      ]
    },
    {
      "id": "moving-platform",
      "kind": "moving_platform",
      "position": [
        11.0,
        0.0,
        -0.2
      ],
      "size": [
        0.7,
        0.7,
        0.2
      ],
      "motion": {
        "axis": [
          0.0,
          1.0,
          0.0
        ],
        "amplitude": 0.5,
        "period_seconds": 3.6
      }
    },
    {
      "id": "gap-5",
      "kind": "gap",
      "position": [
        12.025,
        0.0,
        0.0
      ],
      "size": [
        0.475,
        0.8,
        0.02
      ]
    },
    {
      "id": "finish-zone",
      "kind": "platform",
      "position": [
        13.55,
        0.0,
        -0.2
      ],
      "size": [
        1.05,
        1.2,
        0.2
      ]
    }
  ]
}
