{
  "schema_version": 1,
  "id": "level-08-gap-jump",
  "title": "Gap Jump",
  "order": 8,
  "difficulty": 3,
  "split": "train",
  "tags": [
    "gap",
    "jump"
  ],
  "summary": "Two 50 cm gaps that need a real push-off rather than a single step.",
  "time_limit_seconds": 28.0,
  "par_time_seconds": 13.0,
  "units": {
    "distance": "m",
    "angle": "degree",
    "up_axis": "+z",
    "forward_axis": "+x"
  },
  "spawn": {
    "position": [
      0.0,
      0.0,
      0.94
    ],
    "yaw_degrees": 0.0
  },
  "finish": {
    "position": [
      7.6,
      0.0,
      0.92
    ],
    "radius": 0.85
  },
  "bounds": {
    "minimum": [
      -3.5,
      -4.0,
      -3.0
    ],
    "maximum": [
      10.7,
      4.0,
      5.0
    ]
  },
  "obstacles": [
    {
      "id": "start",
      "kind": "platform",
      "position": [
        1.0,
        0.0,
        -0.2
      ],
      "size": [
        2.0,
        1.2,
        0.2
      ]
    },
    {
      "id": "gap-1",
      "kind": "gap",
      "position": [
        3.25,
        0.0,
        0.0
      ],
      "size": [
        0.25,
        1.2,
        0.02
      ]
    },
    {
      "id": "middle",
      "kind": "platform",
      "position": [
        4.35,
        0.0,
        -0.2
      ],
      "size": [
        0.85,
        1.1,
        0.2
      ]
    },
    {
      "id": "gap-2",
      "kind": "gap",
      "position": [
        5.45,
        0.0,
        0.0
      ],
      "size": [
        0.25,
        1.1,
        0.02
      ]
    },
    {
      "id": "end",
      "kind": "platform",
      "position": [
        6.95,
        0.0,
        -0.2
      ],
      "size": [
        1.25,
        1.2,
        0.2
      ]
    }
  ]
}
