{
  "schema_version": 1,
  "id": "level-02-step-up",
  "title": "Step Up, Step Down",
  "order": 2,
  "difficulty": 1,
  "split": "train",
  "tags": [
    "flat",
    "step"
  ],
  "summary": "Walk onto and off a raised 18 cm platform section without tripping.",
  "time_limit_seconds": 22.0,
  "par_time_seconds": 10.0,
  "units": {
    "distance": "m",
    "angle": "degree",
    "up_axis": "+z",
    "forward_axis": "+x"
  },
  "spawn": {
    "position": [
      0.0,
      0.0,
      0.94
    ],
    "yaw_degrees": 0.0
  },
  "finish": {
    "position": [
      8.0,
      0.0,
      0.92
    ],
    "radius": 0.9
  },
  "bounds": {
    "minimum": [
      -3.5,
      -4.0,
      -3.0
    ],
    "maximum": [
      11.0,
      4.0,
      5.0
    ]
  },
  "obstacles": [
    {
      "id": "runway",
      "kind": "platform",
      "position": [
        3.75,
        0.0,
        -0.2
      ],
      "size": [
        4.75,
        1.3,
        0.2
      ]
    },
    {
      "id": "raised-section",
      "kind": "step",
      "position": [
        4.2,
        0.0,
        -0.11
      ],
      "size": [
        1.2,
        1.3,
        0.29
      ]
    }
  ]
}
